{
  "schemaVersion": 5,
  "skills": [
    {
      "name": "code-review",
      "description": "Reviews a diff, pull request, or set of staged changes for correctness, tests, error and edge cases, security, performance, readability, and architectural fit, then reports severity-ranked, actionable findings with file and line references. Use when reviewing a PR, examining staged or unstaged changes, giving feedback on a patch, or deciding whether a change is safe to merge.",
      "version": "1.0.0",
      "license": "MIT",
      "tier": "core",
      "maturity": {
        "status": "unverified",
        "lastEvaluatedAt": null,
        "evidence": []
      },
      "discovery": {
        "category": "quality",
        "tags": [
          "correctness",
          "diff",
          "pull-request",
          "review"
        ],
        "inputs": [
          {
            "type": "diff",
            "description": "A branch, pull request, or set of staged or unstaged changes."
          }
        ],
        "outputs": [
          {
            "type": "review-findings",
            "description": "Severity-ranked, actionable findings with file and line references."
          }
        ],
        "risk": {
          "level": "low",
          "factors": [
            "read-only"
          ]
        },
        "runtimeCompatibility": [
          {
            "runtime": "claude-code",
            "status": "compatible",
            "notes": null
          },
          {
            "runtime": "github-copilot",
            "status": "compatible",
            "notes": null
          },
          {
            "runtime": "openai-codex",
            "status": "compatible",
            "notes": null
          }
        ],
        "relatedSkills": [
          "security-review",
          "verification-discipline"
        ],
        "conflictingSkills": [],
        "examplePrompts": [
          "Review this pull request for correctness and regressions.",
          "Inspect my staged changes and report only actionable findings."
        ]
      },
      "lifecycle": {
        "status": "active",
        "license": "MIT",
        "lastReviewedAt": "2026-07-27",
        "reviewDueAt": "2027-07-27",
        "origin": {
          "type": "first-party",
          "repository": "https://github.com/Cody-Sims/agent-skills",
          "ref": "5fa48ad8e34edb70532bca7b26fc0d3832fc68f2",
          "commit": "5fa48ad8e34edb70532bca7b26fc0d3832fc68f2"
        }
      },
      "path": "skills/code-review",
      "skillFile": "skills/code-review/SKILL.md",
      "sha256": "50aa64ec203e5e6cf1648cd30dd9ee8b6897c5dc1c81b07ead385a4b62845e43",
      "resources": [
        "references/review-checklist.md"
      ]
    },
    {
      "name": "codebase-exploration",
      "description": "Builds a focused, evidence-based map of an unfamiliar repository before modifying it, locating entry points, build, test, and lint commands, architecture boundaries, conventions, the dependency graph, and the nearest agent instructions, then reading tests to learn intended behavior and finding the smallest correct change site. Use when onboarding to a new or unfamiliar codebase, orienting before a change, or answering how a project is structured and where to edit, while staying read-only.",
      "version": "1.0.1",
      "license": "MIT",
      "tier": "core",
      "maturity": {
        "status": "unverified",
        "lastEvaluatedAt": null,
        "evidence": []
      },
      "discovery": {
        "category": "discovery",
        "tags": [
          "architecture",
          "codebase",
          "onboarding",
          "read-only"
        ],
        "inputs": [
          {
            "type": "repository",
            "description": "An unfamiliar repository or component to map before modification."
          }
        ],
        "outputs": [
          {
            "type": "repository-map",
            "description": "An evidence-based map of entry points, commands, boundaries, and change sites."
          }
        ],
        "risk": {
          "level": "low",
          "factors": [
            "read-only"
          ]
        },
        "runtimeCompatibility": [
          {
            "runtime": "claude-code",
            "status": "compatible",
            "notes": null
          },
          {
            "runtime": "github-copilot",
            "status": "compatible",
            "notes": null
          },
          {
            "runtime": "openai-codex",
            "status": "compatible",
            "notes": null
          }
        ],
        "relatedSkills": [
          "systematic-debugging",
          "web-research-and-verification"
        ],
        "conflictingSkills": [],
        "examplePrompts": [
          "Map this repository before we change the authentication flow.",
          "Find the entry points, test commands, and smallest correct edit location."
        ]
      },
      "lifecycle": {
        "status": "active",
        "license": "MIT",
        "lastReviewedAt": "2026-07-27",
        "reviewDueAt": "2027-07-27",
        "origin": {
          "type": "first-party",
          "repository": "https://github.com/Cody-Sims/agent-skills",
          "ref": "5fa48ad8e34edb70532bca7b26fc0d3832fc68f2",
          "commit": "5fa48ad8e34edb70532bca7b26fc0d3832fc68f2"
        }
      },
      "path": "skills/codebase-exploration",
      "skillFile": "skills/codebase-exploration/SKILL.md",
      "sha256": "fc6b313f089000ec7833bccd6fd31633b1aec4bedd9671247a81cb18eda2c721",
      "resources": [
        "references/exploration-playbook.md"
      ]
    },
    {
      "name": "copilot-cloud-agent",
      "description": "Launches and monitors GitHub Copilot cloud-agent tasks through supported GitHub APIs, selecting explicit models, recording task and pull-request IDs, and distinguishing hosted controls from local CLI flags. Use when starting cloud agents, running hosted loops, assigning issues to Copilot, choosing GPT-5.6 Sol, or checking cloud-agent status; do not use for local subagents or git worktree fleets.",
      "version": "1.0.0",
      "license": "MIT",
      "tier": "experimental",
      "maturity": {
        "status": "verified",
        "lastEvaluatedAt": "2026-07-27",
        "evidence": [
          {
            "type": "structural-validation",
            "reference": "evidence/copilot-cloud-agent/validation.json",
            "sha256": "8d23489eff54ee37c2b1e1e07158cf6cc189a6366eae97c841842ce2c0d7ae20",
            "recordedAt": "2026-07-27"
          },
          {
            "type": "maintainer-approval",
            "reference": "evidence/copilot-cloud-agent/approval.json",
            "sha256": "be3dbfbfc414c82f20c62af0134bc6b5a1d93cb04a756fc0a647baf3682554de",
            "recordedAt": "2026-07-27"
          }
        ]
      },
      "discovery": {
        "category": "delivery",
        "tags": [
          "cloud-agent",
          "github",
          "hosted-task",
          "model-selection"
        ],
        "inputs": [
          {
            "type": "cloud-task-request",
            "description": "A repository, bounded prompt, base ref, pull-request preference, and optional hosted model."
          }
        ],
        "outputs": [
          {
            "type": "cloud-task",
            "description": "A verified hosted task with task, session, model, branch, and pull-request metadata."
          }
        ],
        "risk": {
          "level": "high",
          "factors": [
            "remote-write",
            "repository-write",
            "usage-cost"
          ]
        },
        "runtimeCompatibility": [
          {
            "runtime": "claude-code",
            "status": "compatible",
            "notes": "Requires authenticated access to GitHub's cloud-agent API."
          },
          {
            "runtime": "github-copilot",
            "status": "compatible",
            "notes": "Requires authenticated access to GitHub's cloud-agent API."
          },
          {
            "runtime": "openai-codex",
            "status": "compatible",
            "notes": "Requires authenticated access to GitHub's cloud-agent API."
          }
        ],
        "relatedSkills": [
          "git-and-pr-workflow",
          "verification-before-completion"
        ],
        "conflictingSkills": [],
        "examplePrompts": [
          "Launch a GitHub Copilot cloud agent with GPT-5.6 Sol and create a pull request.",
          "Check which model this hosted Copilot task used and report its current state."
        ]
      },
      "lifecycle": {
        "status": "active",
        "license": "MIT",
        "lastReviewedAt": "2026-07-27",
        "reviewDueAt": "2027-07-27",
        "origin": {
          "type": "first-party",
          "repository": "https://github.com/Cody-Sims/agent-skills",
          "ref": "69e00b0a34f7b95e19b36fdb084152bf5610b1f7",
          "commit": "69e00b0a34f7b95e19b36fdb084152bf5610b1f7"
        }
      },
      "path": "skills/copilot-cloud-agent",
      "skillFile": "skills/copilot-cloud-agent/SKILL.md",
      "sha256": "5c55fe5bda3425f612771e3d3d0fa243ac5d9a9c19792141a4808e986ed91ed0",
      "resources": [
        "references/github-cloud-agent-controls.md"
      ]
    },
    {
      "name": "documentation-maintenance",
      "description": "Keeps README, API docs, architecture notes, ADRs, and changelogs accurate when code changes by identifying which documents a change invalidates, documenting rationale, keeping setup instructions and examples runnable, updating the changelog with user-visible changes, and removing stale content. Use when code, configuration, commands, interfaces, or behavior change and documentation must be updated, or when writing an ADR or changelog entry.",
      "version": "1.0.0",
      "license": "MIT",
      "tier": "core",
      "maturity": {
        "status": "unverified",
        "lastEvaluatedAt": null,
        "evidence": []
      },